book,episode,plant_index,fact,plant_in_act,payoff_in_act,bridging_language,plant_landed,plant_keyword_hits,payoff_class,payoff_overlap,payoff_common_tokens,best_matching_sentence,arc_plan_path,spoken_script_path
ghost-wars,ghost-wars-episode-2,4,The CIA printing Uzbek-language Korans for movement across the northern border.,3,5,"Those books going north were an early sign that the war would not stay inside Afghanistan. Soon it was rockets, not scripture, crossing the Amu Darya.",True,6/7,semantic,0.643,9,Those books going north had been an early sign that the war would not stay inside Afghanistan.,.podcast_agent/runs/final/ghost-wars/ghost-wars-episode-2/spoken_delivery_arc_plan.json,.podcast_agent/runs/final/ghost-wars/ghost-wars-episode-2/spoken_script.json
ghost-wars,ghost-wars-episode-2,5,"Akhtar’s line to Casey: ""Kabul must burn.""",1,3,"Akhtar had put it brutally: Kabul must burn. And by 1985, the city was living that strategy one hidden bomb at a time.",True,5/5,semantic,0.4,4,"By 1985, the city was living that strategy one concealed device at a time.",.podcast_agent/runs/final/ghost-wars/ghost-wars-episode-2/spoken_delivery_arc_plan.json,.podcast_agent/runs/final/ghost-wars/ghost-wars-episode-2/spoken_script.json
ghost-wars,ghost-wars-episode-2,6,"Stanley Bedington’s early assessment of bin Laden: ""He was not a warrior.""",4,5,"He may not have looked like a warrior in the file. At Jaji, he discovered something more useful: how to look like one.",True,4/6,exact,0.444,4,He may not have looked like a warrior in the file.,.podcast_agent/runs/final/ghost-wars/ghost-wars-episode-2/spoken_delivery_arc_plan.json,.podcast_agent/runs/final/ghost-wars/ghost-wars-episode-2/spoken_script.json
ghost-wars,ghost-wars-episode-2,7,Brian Jenkins’s formulation that terrorism is theater.,3,5,"If terrorism is theater, then Jaji was not just a skirmish. It was a debut.",True,3/5,exact,0.8,4,"If terrorism is theater, then Jaji was not just a skirmish.",.podcast_agent/runs/final/ghost-wars/ghost-wars-episode-2/spoken_delivery_arc_plan.json,.podcast_agent/runs/final/ghost-wars/ghost-wars-episode-2/spoken_script.json
ghost-wars,ghost-wars-episode-3,1,"McWilliams's early ""nightmare scenario"" that Najibullah might survive through deals, nationalism, and Soviet aid",1,3,Remember the so-called nightmare scenario from Kabul? This was it: the regime everyone expected to fold was still standing.,True,9/9,exact,0.5,5,Remember the so-called nightmare scenario from Kabul.,.podcast_agent/runs/final/ghost-wars/ghost-wars-episode-3/spoken_delivery_arc_plan.json,.podcast_agent/runs/final/ghost-wars/ghost-wars-episode-3/spoken_script.json
ghost-wars,ghost-wars-episode-3,2,"The phrase ""Afghan self-determination"" from McWilliams's October 1988 cable",2,5,"What McWilliams had called self-determination was now the heart of the fight: who chose Afghanistan's future, Afghans or the intelligence services around them?",True,6/7,exact,0.538,7,"Who chose Afghanistan’s future, Afghans or the intelligence services around them?",.podcast_agent/runs/final/ghost-wars/ghost-wars-episode-3/spoken_delivery_arc_plan.json,.podcast_agent/runs/final/ghost-wars/ghost-wars-episode-3/spoken_script.json
ghost-wars,ghost-wars-episode-3,3,"Bearden's triumphal cable, ""WE WON""",3,6,"That victory cable aged badly. Kabul had fallen, yes—but not into peace.",True,2/3,exact,0.571,4,That victory cable aged badly.,.podcast_agent/runs/final/ghost-wars/ghost-wars-episode-3/spoken_delivery_arc_plan.json,.podcast_agent/runs/final/ghost-wars/ghost-wars-episode-3/spoken_script.json
ghost-wars,ghost-wars-episode-3,4,"The Arab volunteer at the roadblock calling CIA officers ""infidels with no business in Afghanistan""",4,5,The insult on that lonely roadblock was no outlier. It was an early glimpse of where the jihad was turning.,True,7/8,exact,0.5,4,The insult on that lonely roadblock was no outlier.,.podcast_agent/runs/final/ghost-wars/ghost-wars-episode-3/spoken_delivery_arc_plan.json,.podcast_agent/runs/final/ghost-wars/ghost-wars-episode-3/spoken_script.json
ghost-wars,ghost-wars-episode-3,5,The observation after Zia's death that whatever came next in Afghanistan would happen under ISI's shadow,2,6,"And when Kabul finally came within reach, it was still happening under the same shadow.",True,8/10,exact,1.0,8,"And when Kabul finally came within reach, it was still happening under the same shadow.",.podcast_agent/runs/final/ghost-wars/ghost-wars-episode-3/spoken_delivery_arc_plan.json,.podcast_agent/runs/final/ghost-wars/ghost-wars-episode-3/spoken_script.json
ghost-wars,ghost-wars-episode-3,6,Azzam's private fear that bin Laden was drifting toward men who wanted a broader campaign,4,5,"Azzam had worried that the war was no longer enough for some of his followers. In Saudi Arabia, that fear came fully into view.",True,9/9,exact,0.5,6,Azzam had worried that the war was no longer enough for some of his followers.,.podcast_agent/runs/final/ghost-wars/ghost-wars-episode-3/spoken_delivery_arc_plan.json,.podcast_agent/runs/final/ghost-wars/ghost-wars-episode-3/spoken_script.json
ghost-wars,ghost-wars-episode-4,1,Anthony Lake remembered Afghanistan as only 'a small blip on the radar.',1,6,Remember that 'small blip on the radar'—because that was now the country where bin Laden had gone to ground.,True,7/7,semantic,0.778,7,Remember that “small blip on the radar.” Because that was now the country where bin Laden had gone to ground.,.podcast_agent/runs/final/ghost-wars/ghost-wars-episode-4/spoken_delivery_arc_plan.json,.podcast_agent/runs/final/ghost-wars/ghost-wars-episode-4/spoken_script.json
ghost-wars,ghost-wars-episode-4,2,The system first assumes the 1993 attacks must point back to a state sponsor.,2,6,All those early instincts to look for a government mastermind had obscured the thing taking shape in plain sight: a private jihadist network that no state fully controlled.,True,7/8,exact,0.667,12,All those early instincts to look for a government mastermind had obscured the thing taking shape in plain sight.,.podcast_agent/runs/final/ghost-wars/ghost-wars-episode-4/spoken_delivery_arc_plan.json,.podcast_agent/runs/final/ghost-wars/ghost-wars-episode-4/spoken_script.json
ghost-wars,ghost-wars-episode-4,3,Edmund McWilliams warned that Afghanistan had become a 'spawning ground for insurgency.',3,6,That warning into the void—that Afghanistan could export instability—was no longer theoretical.,True,7/8,semantic,1.0,7,"The warning into the void, that Afghanistan could export instability, was no longer theoretical.",.podcast_agent/runs/final/ghost-wars/ghost-wars-episode-4/spoken_delivery_arc_plan.json,.podcast_agent/runs/final/ghost-wars/ghost-wars-episode-4/spoken_script.json
ghost-wars,ghost-wars-episode-4,4,"Bhutto says she was 'slowly, slowly sucked into it.'",4,6,"The force Bhutto said Pakistan had been 'slowly, slowly sucked into' was now in Kabul.",True,4/5,semantic,0.778,7,"The force Bhutto said Pakistan had been “slowly, slowly sucked into” was now in Kabul.",.podcast_agent/runs/final/ghost-wars/ghost-wars-episode-4/spoken_delivery_arc_plan.json,.podcast_agent/runs/final/ghost-wars/ghost-wars-episode-4/spoken_script.json
ghost-wars,ghost-wars-episode-4,5,"Taliban negotiators tell Unocal, 'We want to dominate.'",5,6,And that blunt line from Kandahar—'we want to dominate'—turned out not to be a negotiating pose at all.,True,5/6,semantic,0.875,7,"And that blunt line from Kandahar, “we want to dominate,” turned out not to be a negotiating pose at all.",.podcast_agent/runs/final/ghost-wars/ghost-wars-episode-4/spoken_delivery_arc_plan.json,.podcast_agent/runs/final/ghost-wars/ghost-wars-episode-4/spoken_script.json
ghost-wars,ghost-wars-episode-4,6,"Alec, the CIA’s new virtual bin Laden station, opens just before Khartoum closes.",5,6,The new unit built to follow bin Laden had barely opened its doors before he slipped into the one theater America was least equipped to penetrate.,True,6/8,exact,1.0,12,The new unit built to follow bin Laden had barely opened its doors before he slipped into the one theater America was least equipped to penetrate.,.podcast_agent/runs/final/ghost-wars/ghost-wars-episode-4/spoken_delivery_arc_plan.json,.podcast_agent/runs/final/ghost-wars/ghost-wars-episode-4/spoken_script.json
ghost-wars,ghost-wars-episode-4,7,"In Yousef’s discarded draft, he wrote that the calculations had been wrong and 'next time' they would be accurate.",2,5,That cold promise—next time the calculations would be accurate—echoed in Murad’s airliner plots and the missed chance to catch Khalid Sheikh Mohammed.,True,6/9,semantic,1.0,16,"And that cold promise from years earlier, next time the calculations would be accurate, now echoed in Murad’s airliner plots and in the missed chance to catch Khalid Sheikh Mohammed.",.podcast_agent/runs/final/ghost-wars/ghost-wars-episode-4/spoken_delivery_arc_plan.json,.podcast_agent/runs/final/ghost-wars/ghost-wars-episode-4/spoken_script.json
ghost-wars,ghost-wars-episode-5,1,"The public cry in Kandahar: men pointing and whispering, ""Osama, Osama""",1,6,"Remember how public he was in Kandahar—""Osama, Osama""—because after Nairobi the most haunting fact is that this was an enemy America had already seen.",True,3/5,exact,1.0,11,"Remember how public he was in Kandahar, “Osama, Osama,” because after Nairobi the most haunting fact is that this was an enemy America had already seen.",.podcast_agent/runs/final/ghost-wars/ghost-wars-episode-5/spoken_delivery_arc_plan.json,.podcast_agent/runs/final/ghost-wars/ghost-wars-episode-5/spoken_script.json
ghost-wars,ghost-wars-episode-5,2,Taliban leaders tell Schroen they are keeping the Stingers to defeat Massoud and then prepare for war with Iran,2,7,"They had said it years earlier when they refused the missiles: first Massoud, then the wider war. Washington just did not hear it for what it was.",True,9/10,exact,0.6,6,"Taliban officials had said it outright when they refused the missiles: first Massoud, then the wider war.",.podcast_agent/runs/final/ghost-wars/ghost-wars-episode-5/spoken_delivery_arc_plan.json,.podcast_agent/runs/final/ghost-wars/ghost-wars-episode-5/spoken_script.json
ghost-wars,ghost-wars-episode-5,3,The desert landing strip tested during the Kasi hunt,3,5,"The strip they had tested for Mir Amal Kasi was still there, waiting for a different fugitive.",True,6/6,exact,1.0,7,"The strip they had tested for Mir Amal Kasi was still there, waiting for a different fugitive.",.podcast_agent/runs/final/ghost-wars/ghost-wars-episode-5/spoken_delivery_arc_plan.json,.podcast_agent/runs/final/ghost-wars/ghost-wars-episode-5/spoken_script.json
ghost-wars,ghost-wars-episode-5,4,Schroen's instruction to the Afghan team: capture him alive,3,7,Go back to the phrase that governed everything in the field—capture him alive—because by late 1998 Washington was simultaneously authorizing capture and preparing to kill.,True,5/6,semantic,0.571,8,Because by late 1998 Washington was simultaneously authorizing capture and preparing to kill.,.podcast_agent/runs/final/ghost-wars/ghost-wars-episode-5/spoken_delivery_arc_plan.json,.podcast_agent/runs/final/ghost-wars/ghost-wars-episode-5/spoken_script.json
ghost-wars,ghost-wars-episode-5,5,"Massoud's warning that the real danger is the Taliban, Pakistani intelligence, and Arab volunteers together",2,7,Massoud had been trying to tell them all along that these were not separate enemies but a single coalition.,True,10/10,exact,1.0,10,Massoud had been trying to tell them all along that these were not separate enemies but a single coalition.,.podcast_agent/runs/final/ghost-wars/ghost-wars-episode-5/spoken_delivery_arc_plan.json,.podcast_agent/runs/final/ghost-wars/ghost-wars-episode-5/spoken_script.json
ghost-wars,ghost-wars-episode-5,6,Saudi confidence that the Taliban would keep bin Laden quiet if given refuge,1,6,"That earlier Saudi assumption—that the Taliban could keep him quiet—now collapses in Kandahar, face to face with Mullah Omar.",True,8/8,semantic,0.909,10,"And now that earlier Saudi assumption, that the Taliban could keep him quiet, collapsed in Kandahar face to face with Mullah Omar.",.podcast_agent/runs/final/ghost-wars/ghost-wars-episode-5/spoken_delivery_arc_plan.json,.podcast_agent/runs/final/ghost-wars/ghost-wars-episode-5/spoken_script.json
ghost-wars,ghost-wars-episode-5,7,The embassy in Washington split by competing Afghan flags,4,7,"The embassy without a country was more than symbolism; it was a preview of Washington's deeper confusion about who Afghanistan belonged to, and who the enemy really was.",True,5/6,exact,0.75,9,"It was a preview of Washington’s deeper confusion about who Afghanistan belonged to, and who the enemy really was.",.podcast_agent/runs/final/ghost-wars/ghost-wars-episode-5/spoken_delivery_arc_plan.json,.podcast_agent/runs/final/ghost-wars/ghost-wars-episode-5/spoken_script.json
ghost-wars,ghost-wars-episode-6,1,The Pakistani commando unit funded through Ziauddin is not just an anti-bin-Laden asset; it is also imagined as personal insurance for Nawaz Sharif.,1,4,"Remember that force the CIA was helping Ziauddin build, the one meant to catch bin Laden but also to protect Sharif? On the day Sharif needed it most, it vanished.",True,11/13,exact,0.833,10,"Remember that force the CIA was helping Ziauddin build, the one meant to catch bin Laden but also to protect Sharif?",.podcast_agent/runs/final/ghost-wars/ghost-wars-episode-6/spoken_delivery_arc_plan.json,.podcast_agent/runs/final/ghost-wars/ghost-wars-episode-6/spoken_script.json
ghost-wars,ghost-wars-episode-6,2,Bin Laden became harder to track after reports exposed the U.S. satellite-phone intercepts.,1,6,"That early loss of easy access mattered more than it first seemed. Even after all the new agents, maps, and gear, the Americans were still chasing the shadow left behind when bin Laden went dark.",True,7/9,exact,0.632,12,"Even after all the new agents, maps, and gear, the Americans were still chasing the shadow left behind when bin Laden went dark.",.podcast_agent/runs/final/ghost-wars/ghost-wars-episode-6/spoken_delivery_arc_plan.json,.podcast_agent/runs/final/ghost-wars/ghost-wars-episode-6/spoken_script.json
ghost-wars,ghost-wars-episode-6,3,"In the Oval Office, bin Laden is treated as only the third issue behind nuclear and economic concerns.",1,6,"Back in December, terrorism had come third. Two years later, the policy still carried that hierarchy inside it.",True,9/10,exact,0.545,6,"Two years later, the policy still carried that hierarchy inside it.",.podcast_agent/runs/final/ghost-wars/ghost-wars-episode-6/spoken_delivery_arc_plan.json,.podcast_agent/runs/final/ghost-wars/ghost-wars-episode-6/spoken_script.json
ghost-wars,ghost-wars-episode-6,4,"Cofer Black insists on plain, restrictive ""Special English"" authorities for dealing with Massoud.",3,6,"All that careful Washington language lasted right up until Massoud's men were already on mules, carrying rockets toward Derunta.",True,9/10,exact,1.0,12,"All that careful Washington language lasted right up until Massoud’s men were already on mules, carrying rockets toward Derunta.",.podcast_agent/runs/final/ghost-wars/ghost-wars-episode-6/spoken_delivery_arc_plan.json,.podcast_agent/runs/final/ghost-wars/ghost-wars-episode-6/spoken_script.json
ghost-wars,ghost-wars-episode-6,5,Massoud's core critique is that bin Laden is only one piece of a larger protection system.,4,6,"Massoud had warned them not to confuse the man with the system. By 2000, every dead end seemed to prove his point.",True,8/8,exact,0.5,5,Massoud had warned them not to confuse the man with the system.,.podcast_agent/runs/final/ghost-wars/ghost-wars-episode-6/spoken_delivery_arc_plan.json,.podcast_agent/runs/final/ghost-wars/ghost-wars-episode-6/spoken_script.json
ghost-wars,ghost-wars-episode-6,6,Khalid al-Mihdhar's passport showed a valid multiple-entry U.S. visa.,5,6,The visa was there in black and white. What the system never did was treat it like the emergency it was.,True,8/8,exact,0.625,5,What the system never did was treat it like the emergency it was.,.podcast_agent/runs/final/ghost-wars/ghost-wars-episode-6/spoken_delivery_arc_plan.json,.podcast_agent/runs/final/ghost-wars/ghost-wars-episode-6/spoken_script.json
ghost-wars,ghost-wars-episode-7,1,Berger's warning that 'the light at the end of the tunnel might just be another tunnel.',1,6,"Remember Berger's warning about another tunnel: by September 4, even apparent progress still opened into more delay.",True,5/6,exact,0.5,6,Remember Berger’s warning about another tunnel.,.podcast_agent/runs/final/ghost-wars/ghost-wars-episode-7/spoken_delivery_arc_plan.json,.podcast_agent/runs/final/ghost-wars/ghost-wars-episode-7/spoken_script.json
ghost-wars,ghost-wars-episode-7,2,"The image of Tarnak Farm as both target and shield: the mosque, the clinic, the family quarters, the laundry lines, the wooden swing.",2,6,"And remember what Tarnak looked like up close—not just a target, but a place with families in it. That was the fear haunting every lethal debate.",True,13/13,semantic,0.385,5,And remember what Tarnak looked like up close.,.podcast_agent/runs/final/ghost-wars/ghost-wars-episode-7/spoken_delivery_arc_plan.json,.podcast_agent/runs/final/ghost-wars/ghost-wars-episode-7/spoken_script.json
ghost-wars,ghost-wars-episode-7,3,"The 'Blue Sky memo' request for helicopters, cash, and a real presence with Massoud—and the Mi-17 that was then mothballed.",3,6,"The equipment they had once mothballed was now back on the table—helicopters, ammunition, trucks—only now it was September.",True,7/9,exact,1.0,9,"The equipment they had once mothballed was now back on the table, helicopters, ammunition, trucks, only now it was September.",.podcast_agent/runs/final/ghost-wars/ghost-wars-episode-7/spoken_delivery_arc_plan.json,.podcast_agent/runs/final/ghost-wars/ghost-wars-episode-7/spoken_script.json
ghost-wars,ghost-wars-episode-7,4,Bush saying he was tired of 'swatting flies.',5,6,"Months after Bush said he wanted to stop swatting flies, Clarke was still writing that that was exactly what they were doing.",True,4/5,exact,1.0,11,"Months after Bush said he wanted to stop swatting flies, Clarke was still writing that that was exactly what they were doing.",.podcast_agent/runs/final/ghost-wars/ghost-wars-episode-7/spoken_delivery_arc_plan.json,.podcast_agent/runs/final/ghost-wars/ghost-wars-episode-7/spoken_script.json
ghost-wars,ghost-wars-episode-7,5,Massoud's Strasbourg warning that terrorists would hit the United States and Europe 'very soon.',5,6,The man who had warned 'very soon' would not live to see how soon.,True,8/9,semantic,0.8,4,The man who had warned ‘very soon’ would not live to see how soon.,.podcast_agent/runs/final/ghost-wars/ghost-wars-episode-7/spoken_delivery_arc_plan.json,.podcast_agent/runs/final/ghost-wars/ghost-wars-episode-7/spoken_script.json
ghost-wars,ghost-wars-episode-7,6,"Khalid al-Mihdhar and Nawaf al-Hazmi were known from Kuala Lumpur, had U.S. visas, and had never been watch-listed.",5,6,"While officials debated Afghanistan in principle, two known al Qaeda men had already spent months in plain sight inside the country.",True,11/11,semantic,0.667,8,Two known al Qaeda men had already spent months in plain sight inside the country.,.podcast_agent/runs/final/ghost-wars/ghost-wars-episode-7/spoken_delivery_arc_plan.json,.podcast_agent/runs/final/ghost-wars/ghost-wars-episode-7/spoken_script.json
god-s-shadow,god-s-shadow-episode-1,1,"The dynasty's saying: ""there are no ties of kinship between princes.""",2,3,Remember the Ottoman rule you heard in Amasya—that between princes there were no real bonds of kinship. Mehmet's death is where that principle stops sounding proverbial and starts spilling blood.,True,4/5,exact,0.5,9,Mehmet’s death is where that principle stops sounding proverbial and starts spilling blood.,.podcast_agent/runs/final/god-s-shadow/god-s-shadow-episode-1/spoken_delivery_arc_plan.json,.podcast_agent/runs/final/god-s-shadow/god-s-shadow-episode-1/spoken_script.json
god-s-shadow,god-s-shadow-episode-1,2,Gülbahar was born a Christian in Albania before becoming mother to an Ottoman prince.,2,4,"The woman teaching Selim how to rule had herself crossed the empire's religious frontier; that matters in Trabzon, where Ottoman power depends on governing difference, not pretending it doesn't exist.",True,8/8,exact,0.526,10,"That matters in Trabzon, where Ottoman power depends on governing difference, not pretending it doesn’t exist.",.podcast_agent/runs/final/god-s-shadow/god-s-shadow-episode-1/spoken_delivery_arc_plan.json,.podcast_agent/runs/final/god-s-shadow/god-s-shadow-episode-1/spoken_script.json
god-s-shadow,god-s-shadow-episode-1,3,"Ottoman control of trade routes and strategic choke points like Bursa, Constantinople, and the eastern Mediterranean.",2,5,"Those eastern routes the Ottomans sat astride are the pressure behind Columbus's westward logic: if wealth cannot be safely reached through the old sea, try another ocean.",True,12/12,exact,1.0,16,"Those eastern routes the Ottomans sat astride are the pressure behind Columbus’s westward logic: if wealth cannot be safely reached through the old sea, try another ocean.",.podcast_agent/runs/final/god-s-shadow/god-s-shadow-episode-1/spoken_delivery_arc_plan.json,.podcast_agent/runs/final/god-s-shadow/god-s-shadow-episode-1/spoken_script.json
god-s-shadow,god-s-shadow-episode-1,4,"Matamoros means ""Moor-slayer.""",5,6,"That old Moor-slayer grammar doesn't stay in Iberia. In the Americas it mutates—Mataindios, new enemies spoken in old words.",True,3/4,exact,0.5,6,That old Moor-slayer grammar doesn’t stay in Iberia.,.podcast_agent/runs/final/god-s-shadow/god-s-shadow-episode-1/spoken_delivery_arc_plan.json,.podcast_agent/runs/final/god-s-shadow/god-s-shadow-episode-1/spoken_script.json
god-s-shadow,god-s-shadow-episode-1,5,"The Ottoman ideal of the Circle of Justice: no troops without money, no money without prosperity, no prosperity without justice.",4,6,"Set the Circle of Justice beside the Requirement and the difference comes into focus: both empires wanted obedience, but they justified extraction in strikingly different moral languages.",True,7/7,exact,0.438,7,Set the Circle of Justice beside the Requirement and the difference comes into focus.,.podcast_agent/runs/final/god-s-shadow/god-s-shadow-episode-1/spoken_delivery_arc_plan.json,.podcast_agent/runs/final/god-s-shadow/god-s-shadow-episode-1/spoken_script.json
god-s-shadow,god-s-shadow-episode-1,6,"Cem told the pope he would never help Christians against a Muslim empire, not even for rule over the whole world.",3,5,"Cem rejected the Christian fantasy of turning an Ottoman prince against Islam. Columbus, by contrast, sells rulers another version of the same dream: reach Asia, find allies, strike the Muslim world from a different direction.",True,12/12,weak,0.16,4,Back to a provincial Ottoman court where another prince was being raised in the same system.,.podcast_agent/runs/final/god-s-shadow/god-s-shadow-episode-1/spoken_delivery_arc_plan.json,.podcast_agent/runs/final/god-s-shadow/god-s-shadow-episode-1/spoken_script.json
god-s-shadow,god-s-shadow-episode-2,1,"Spain feared sending Islam into a ""new Catholic world"" and tried to filter slaves through baptism and observation as ladinos.",2,3,"Remember what the Crown feared from the start: not just labor crossing the Atlantic, but Islam crossing with it.",True,10/12,exact,1.0,8,"Remember what the Crown feared from the start: not just labor crossing the Atlantic, but Islam crossing with it.",.podcast_agent/runs/final/god-s-shadow/god-s-shadow-episode-2/spoken_delivery_arc_plan.json,.podcast_agent/runs/final/god-s-shadow/god-s-shadow-episode-2/spoken_script.json
god-s-shadow,god-s-shadow-episode-2,2,Bahoruco is introduced as terrain where Spanish power thins out and another world can take shape.,3,3,The mountains were not an escape hatch; they were the place where Spanish authority stopped being absolute.,True,8/10,exact,0.625,5,They were the place where Spanish authority stopped being absolute.,.podcast_agent/runs/final/god-s-shadow/god-s-shadow-episode-2/spoken_delivery_arc_plan.json,.podcast_agent/runs/final/god-s-shadow/god-s-shadow-episode-2/spoken_script.json
god-s-shadow,god-s-shadow-episode-2,3,Bayezit II actively welcomed Jewish refugees in 1492 and made the Ottoman Empire imaginable as refuge.,4,7,This was the empire Selim inherited: one already strengthened by the very exiles Christian Europe had cast out.,True,10/10,exact,0.625,5,One already strengthened by the very exiles Christian Europe had cast out.,.podcast_agent/runs/final/god-s-shadow/god-s-shadow-episode-2/spoken_delivery_arc_plan.json,.podcast_agent/runs/final/god-s-shadow/god-s-shadow-episode-2/spoken_script.json
god-s-shadow,god-s-shadow-episode-2,4,Trabzon appears first as a frontier city where coexistence is useful but fragile.,4,5,"And in that uneasy border city, Selim learned what rule looked like when danger was never theoretical.",True,7/8,exact,1.0,11,"And in that uneasy border city, Selim learned what rule looked like when danger was never theoretical.",.podcast_agent/runs/final/god-s-shadow/god-s-shadow-episode-2/spoken_delivery_arc_plan.json,.podcast_agent/runs/final/god-s-shadow/god-s-shadow-episode-2/spoken_script.json
god-s-shadow,god-s-shadow-episode-2,5,"The Kızılbaş are marked by their bright red, twelve-point headgear.",5,6,Now that red headgear shows up inside the Ottoman family itself — on Ahmed's own son.,True,5/5,exact,1.0,7,"Now that red headgear shows up inside the Ottoman family itself, on Ahmed's own son.",.podcast_agent/runs/final/god-s-shadow/god-s-shadow-episode-2/spoken_delivery_arc_plan.json,.podcast_agent/runs/final/god-s-shadow/god-s-shadow-episode-2/spoken_script.json
