book,episode,plant_index,fact,plant_in_act,payoff_in_act,bridging_language,plant_landed,plant_keyword_hits,payoff_class,payoff_overlap,payoff_common_tokens,best_matching_sentence,arc_plan_path,spoken_script_path
the-crusades-an-authoritative-history,the-crusades-an-authoritative-history-episode-1,1,Urban's revolutionary offer: remission of sins for an armed pilgrimage,1,7,Remember Urban's impossible promise—that a man could go east with a sword and still travel as a pilgrim.,True,7/7,exact,1.0,8,"Remember Urban's impossible promise, that a man could go east with a sword and still travel as a pilgrim.",.podcast_agent/runs/final/the-crusades-an-authoritative-history/the-crusades-an-authoritative-history-episode-1/spoken_delivery_arc_plan.json,.podcast_agent/runs/final/the-crusades-an-authoritative-history/the-crusades-an-authoritative-history-episode-1/spoken_script.json
the-crusades-an-authoritative-history,the-crusades-an-authoritative-history-episode-1,2,Bohemond enters the crusade with 'hopes of advancement in the East',2,5,The Norman who came east looking for advancement had finally found the prize he wanted.,True,3/6,semantic,0.889,8,The Norman who had come east looking for advancement had finally found the prize he wanted.,.podcast_agent/runs/final/the-crusades-an-authoritative-history/the-crusades-an-authoritative-history-episode-1/spoken_delivery_arc_plan.json,.podcast_agent/runs/final/the-crusades-an-authoritative-history/the-crusades-an-authoritative-history-episode-1/spoken_script.json
the-crusades-an-authoritative-history,the-crusades-an-authoritative-history-episode-1,3,Baldwin is introduced as the intense younger brother who may see the crusade as 'a new beginning in the Holy Land',2,8,That lesser-known brother from Lorraine would end up giving the conquest its most durable political shape.,True,7/9,exact,1.0,9,That lesser-known brother from Lorraine would end up giving the conquest its most durable political shape.,.podcast_agent/runs/final/the-crusades-an-authoritative-history/the-crusades-an-authoritative-history-episode-1/spoken_delivery_arc_plan.json,.podcast_agent/runs/final/the-crusades-an-authoritative-history/the-crusades-an-authoritative-history-episode-1/spoken_script.json
the-crusades-an-authoritative-history,the-crusades-an-authoritative-history-episode-1,4,Alexius's oath: any recovered former Roman city is to be returned to Byzantium,3,6,Remember the promise made in Constantinople—that cities won in the East were not supposed to stay Frankish at all.,True,7/8,semantic,1.0,9,And remember the promise made in Constantinople: cities won in the East were not supposed to stay Frankish at all.,.podcast_agent/runs/final/the-crusades-an-authoritative-history/the-crusades-an-authoritative-history-episode-1/spoken_delivery_arc_plan.json,.podcast_agent/runs/final/the-crusades-an-authoritative-history/the-crusades-an-authoritative-history-episode-1/spoken_script.json
the-crusades-an-authoritative-history,the-crusades-an-authoritative-history-episode-1,5,The crusade has no single commander and must govern itself by council,2,6,The strength that got them this far—the absence of one master—was now becoming the thing that kept them from Jerusalem.,True,6/6,semantic,1.0,8,"As councils failed and delay dragged on, the strength that had got them this far - the absence of one master - was now becoming the thing that kept them from Jerusalem.",.podcast_agent/runs/final/the-crusades-an-authoritative-history/the-crusades-an-authoritative-history-episode-1/spoken_delivery_arc_plan.json,.podcast_agent/runs/final/the-crusades-an-authoritative-history/the-crusades-an-authoritative-history-episode-1/spoken_script.json
the-crusades-an-authoritative-history,the-crusades-an-authoritative-history-episode-1,6,"In this world, relics are not symbols but realities that can shape morale, legitimacy, and battle",3,5,"In a world that had just passed through Constantinople's treasury of holy things, a spear lifted from the ground could change an army's will.",True,7/8,exact,1.0,11,"In a world that had just passed through Constantinople's treasury of holy things, a spear lifted from the ground could change an army's will.",.podcast_agent/runs/final/the-crusades-an-authoritative-history/the-crusades-an-authoritative-history-episode-1/spoken_delivery_arc_plan.json,.podcast_agent/runs/final/the-crusades-an-authoritative-history/the-crusades-an-authoritative-history-episode-1/spoken_script.json
the-crusades-an-authoritative-history,the-crusades-an-authoritative-history-episode-1,7,The emperor advises practical caution about Turkish tactics and the need for diplomacy as well as force,3,8,The hard lesson Alexius understood from the start—that survival in the East required bargaining as often as battle—would end up defining Outremer.,True,9/11,semantic,0.923,12,The hard lesson Alexius had understood from the start - that survival in the East required bargaining as often as battle - was becoming the daily logic of Outremer.,.podcast_agent/runs/final/the-crusades-an-authoritative-history/the-crusades-an-authoritative-history-episode-1/spoken_delivery_arc_plan.json,.podcast_agent/runs/final/the-crusades-an-authoritative-history/the-crusades-an-authoritative-history-episode-1/spoken_script.json
the-crusades-an-authoritative-history,the-crusades-an-authoritative-history-episode-2,1,"The Aqsa mosque is the Templars' headquarters, renamed by the Franks as the Temple of Solomon.",2,6,Remember the place the Franks had turned into the Temple of Solomon — Nur al-Din is now carving a pulpit for that same sanctuary.,True,5/8,exact,1.0,10,Remember the place the Franks had turned into the Temple of Solomon — Nur al-Din is now carving a pulpit for that same sanctuary.,.podcast_agent/runs/final/the-crusades-an-authoritative-history/the-crusades-an-authoritative-history-episode-2/spoken_delivery_arc_plan.json,.podcast_agent/runs/final/the-crusades-an-authoritative-history/the-crusades-an-authoritative-history-episode-2/spoken_script.json
the-crusades-an-authoritative-history,the-crusades-an-authoritative-history-episode-2,2,Outremer cannot rely on its own strength alone.,2,4,The truth Jerusalem had already learned — that it could not save itself — was now about to be tested on the largest possible scale.,True,5/5,exact,1.0,10,The truth Jerusalem had already learned — that it could not save itself — was now about to be tested on the largest possible scale.,.podcast_agent/runs/final/the-crusades-an-authoritative-history/the-crusades-an-authoritative-history-episode-2/spoken_delivery_arc_plan.json,.podcast_agent/runs/final/the-crusades-an-authoritative-history/the-crusades-an-authoritative-history-episode-2/spoken_script.json
the-crusades-an-authoritative-history,the-crusades-an-authoritative-history-episode-2,3,Damascus once chose alliance with Jerusalem against Zangi and offered tribute and Banyas for help.,3,4,The city that had once paid the Franks to protect it was now the city they had decided to attack.,True,11/11,exact,1.0,7,The city that had once paid the Franks to protect it was now the city they had decided to attack.,.podcast_agent/runs/final/the-crusades-an-authoritative-history/the-crusades-an-authoritative-history-episode-2/spoken_delivery_arc_plan.json,.podcast_agent/runs/final/the-crusades-an-authoritative-history/the-crusades-an-authoritative-history-episode-2/spoken_script.json
the-crusades-an-authoritative-history,the-crusades-an-authoritative-history-episode-2,4,Zangi installs Ayyub ibn Shadi at Baalbek.,3,6,"That name, almost incidental earlier — Ayyub ibn Shadi — returns now through his son, Yusuf ibn Ayyub.",True,4/5,exact,1.0,8,"That name, almost incidental earlier — Ayyub ibn Shadi — returns now through his son, Yusuf ibn Ayyub.",.podcast_agent/runs/final/the-crusades-an-authoritative-history/the-crusades-an-authoritative-history-episode-2/spoken_delivery_arc_plan.json,.podcast_agent/runs/final/the-crusades-an-authoritative-history/the-crusades-an-authoritative-history-episode-2/spoken_script.json
the-crusades-an-authoritative-history,the-crusades-an-authoritative-history-episode-2,5,The Military Orders provide one of the few trained standing forces in the Latin East.,2,4,This was exactly the kind of catastrophe the Templars had been created for.,True,6/8,exact,1.0,5,This was exactly the kind of catastrophe the Templars had been created for.,.podcast_agent/runs/final/the-crusades-an-authoritative-history/the-crusades-an-authoritative-history-episode-2/spoken_delivery_arc_plan.json,.podcast_agent/runs/final/the-crusades-an-authoritative-history/the-crusades-an-authoritative-history-episode-2/spoken_script.json
the-crusades-an-authoritative-history,the-crusades-an-authoritative-history-episode-2,6,"Nur al-Din repeatedly chooses leverage and buffers over reckless conquest, even after major victories.",5,6,"As at Antioch before, he wins heavily — and still does not lunge for everything at once.",True,4/9,exact,1.0,6,"As at Antioch before, he wins heavily — and still does not lunge for everything at once.",.podcast_agent/runs/final/the-crusades-an-authoritative-history/the-crusades-an-authoritative-history-episode-2/spoken_delivery_arc_plan.json,.podcast_agent/runs/final/the-crusades-an-authoritative-history/the-crusades-an-authoritative-history-episode-2/spoken_script.json
the-crusades-an-authoritative-history,the-crusades-an-authoritative-history-episode-3,1,"Saladin's earliest posture in Syria is that of servant and guardian to al-Salih, not open usurper.",1,7,"Remember how he first entered Syria claiming not to seize a kingdom but to protect one. In Jerusalem, at last, he could make that pose look like destiny.",True,7/9,exact,0.533,8,Remember how he first entered Syria claiming not to seize a kingdom but to protect one.,.podcast_agent/runs/final/the-crusades-an-authoritative-history/the-crusades-an-authoritative-history-episode-3/spoken_delivery_arc_plan.json,.podcast_agent/runs/final/the-crusades-an-authoritative-history/the-crusades-an-authoritative-history-episode-3/spoken_script.json
the-crusades-an-authoritative-history,the-crusades-an-authoritative-history-episode-3,2,"Baldwin's numb right arm is discovered in the childhood game, and he learns to ride by controlling the horse with his knees.",2,3,The boy who could not feel pain in his own arm was now the king who could still ride out and hit back.,True,7/11,exact,1.0,5,The boy who could not feel pain in his own arm was now the king who could still ride out and hit back.,.podcast_agent/runs/final/the-crusades-an-authoritative-history/the-crusades-an-authoritative-history-episode-3/spoken_delivery_arc_plan.json,.podcast_agent/runs/final/the-crusades-an-authoritative-history/the-crusades-an-authoritative-history-episode-3/spoken_script.json
the-crusades-an-authoritative-history,the-crusades-an-authoritative-history-episode-3,3,"Reynald of Chatillon returns from captivity, marries into Transjordan, and reenters politics as lord of Kerak and Montreal.",2,6,"The man who kept turning border war into personal provocation was now standing in Saladin's tent, and this time there would be no ransom.",True,8/11,exact,1.0,10,"The man who kept turning border war into personal provocation was now standing in Saladin’s tent, and this time there would be no ransom.",.podcast_agent/runs/final/the-crusades-an-authoritative-history/the-crusades-an-authoritative-history-episode-3/spoken_delivery_arc_plan.json,.podcast_agent/runs/final/the-crusades-an-authoritative-history/the-crusades-an-authoritative-history-episode-3/spoken_script.json
the-crusades-an-authoritative-history,the-crusades-an-authoritative-history-episode-3,4,"At Jacob's Ford, Saladin learns again that crossings, supply, and timing matter more than chivalric display.",3,6,"What mattered at Jacob's Ford mattered even more at Hattin: control the ground, control the water, and you control the battle.",True,8/11,exact,1.0,9,"And what mattered at Jacob’s Ford mattered even more at Hattin: control the ground, control the water, and you control the battle.",.podcast_agent/runs/final/the-crusades-an-authoritative-history/the-crusades-an-authoritative-history-episode-3/spoken_delivery_arc_plan.json,.podcast_agent/runs/final/the-crusades-an-authoritative-history/the-crusades-an-authoritative-history-episode-3/spoken_script.json
the-crusades-an-authoritative-history,the-crusades-an-authoritative-history-episode-3,5,The Red Sea raid makes Reynald's name synonymous in Muslim memory with sacrilege and outrage.,4,6,"Saladin was not facing just another captive lord. He was facing the name that had been linked, for years, with the desecration of holy routes.",True,7/9,semantic,0.636,7,"He was facing the man whose name had been linked for years with desecration, outrage, broken truces, and the violation of holy routes.",.podcast_agent/runs/final/the-crusades-an-authoritative-history/the-crusades-an-authoritative-history-episode-3/spoken_delivery_arc_plan.json,.podcast_agent/runs/final/the-crusades-an-authoritative-history/the-crusades-an-authoritative-history-episode-3/spoken_script.json
the-crusades-an-authoritative-history,the-crusades-an-authoritative-history-episode-3,6,"At Harran, the possibility is raised that if Saladin dies then, history will remember him as a conqueror of Muslims more than a champion against the Franks.",5,7,"At Harran, the verdict on Saladin was still unwritten. Jerusalem would write it.",True,10/12,exact,0.667,4,"At Harran, the verdict on Saladin was still unwritten.",.podcast_agent/runs/final/the-crusades-an-authoritative-history/the-crusades-an-authoritative-history-episode-3/spoken_delivery_arc_plan.json,.podcast_agent/runs/final/the-crusades-an-authoritative-history/the-crusades-an-authoritative-history-episode-3/spoken_script.json
the-crusades-an-authoritative-history,the-crusades-an-authoritative-history-episode-3,7,"Guy marches beneath the True Cross, the kingdom's supreme field symbol.",5,6,The relic that had gone out to sanctify the army would come back upside down on a Muslim lance.,True,6/8,semantic,0.889,8,"The relic that had gone out to sanctify the army came back upside down on a Muslim lance, carried to Damascus.",.podcast_agent/runs/final/the-crusades-an-authoritative-history/the-crusades-an-authoritative-history-episode-3/spoken_delivery_arc_plan.json,.podcast_agent/runs/final/the-crusades-an-authoritative-history/the-crusades-an-authoritative-history-episode-3/spoken_script.json
the-crusades-an-authoritative-history,the-crusades-an-authoritative-history-episode-4,1,The True Cross lost at Hattin becomes the emblem of what this crusade is supposed to recover,1,6,"Remember the object Audita Tremendi singled out at the very start—the True Cross. Even after Acre, Arsuf, and Jaffa, it was still not coming back.",True,7/9,exact,0.571,8,"Remember the object Audita Tremendi singled out at the very start, the True Cross.",.podcast_agent/runs/final/the-crusades-an-authoritative-history/the-crusades-an-authoritative-history-episode-4/spoken_delivery_arc_plan.json,.podcast_agent/runs/final/the-crusades-an-authoritative-history/the-crusades-an-authoritative-history-episode-4/spoken_script.json
the-crusades-an-authoritative-history,the-crusades-an-authoritative-history-episode-4,2,Tyre's survival under Conrad of Montferrat,2,6,The man who saved Tyre after Hattin had never stopped shaping this war—and now the whole kingdom was swinging toward him.,True,3/4,exact,1.0,10,"The man who saved Tyre after Hattin had never stopped shaping this war, and now the whole kingdom was swinging toward him.",.podcast_agent/runs/final/the-crusades-an-authoritative-history/the-crusades-an-authoritative-history-episode-4/spoken_delivery_arc_plan.json,.podcast_agent/runs/final/the-crusades-an-authoritative-history/the-crusades-an-authoritative-history-episode-4/spoken_script.json
the-crusades-an-authoritative-history,the-crusades-an-authoritative-history-episode-4,3,"The crusade is being built for the sea: ships, stores, discipline aboard ship, and the costly decision to go by water",1,5,This was the campaign Richard had prepared for from the start—a crusade that lived or died by the coast and by the ships shadowing it.,True,10/10,semantic,0.4,4,A crusade that would live or die by the coast and by the ships shadowing it.,.podcast_agent/runs/final/the-crusades-an-authoritative-history/the-crusades-an-authoritative-history-episode-4/spoken_delivery_arc_plan.json,.podcast_agent/runs/final/the-crusades-an-authoritative-history/the-crusades-an-authoritative-history-episode-4/spoken_script.json
the-crusades-an-authoritative-history,the-crusades-an-authoritative-history-episode-4,4,"Henry and Philip vow together at Gisors, but neither trusts the other enough to leave home first",1,4,"That old suspicion from Gisors never really left the crusade; Acre had fallen, but Philip still did not want Richard alone with time and advantage.",True,9/10,semantic,0.571,8,"Acre had fallen, yet Philip still did not want Richard alone with time and advantage.",.podcast_agent/runs/final/the-crusades-an-authoritative-history/the-crusades-an-authoritative-history-episode-4/spoken_delivery_arc_plan.json,.podcast_agent/runs/final/the-crusades-an-authoritative-history/the-crusades-an-authoritative-history-episode-4/spoken_script.json
the-crusades-an-authoritative-history,the-crusades-an-authoritative-history-episode-4,5,Frederick Barbarossa looks like the one ruler who has truly translated crusading intent into action,1,3,And the ruler who seemed most certain to reach the Holy Land did not fall in battle at all—he vanished in a river.,True,8/10,exact,0.8,8,And the ruler who seemed most certain to reach the Holy Land did not fall in battle at all.,.podcast_agent/runs/final/the-crusades-an-authoritative-history/the-crusades-an-authoritative-history-episode-4/spoken_delivery_arc_plan.json,.podcast_agent/runs/final/the-crusades-an-authoritative-history/the-crusades-an-authoritative-history-episode-4/spoken_script.json
the-crusades-an-authoritative-history,the-crusades-an-authoritative-history-episode-4,6,"Saladin releases Guy of Lusignan in 1188, a decision whose motives are unclear",2,3,"The captive king Saladin had chosen to let go was now the man outside Acre, creating the crisis he most needed to avoid.",True,5/7,semantic,0.7,7,The captive king Saladin had chosen to let go was now the man about to create the crisis he most needed to avoid.,.podcast_agent/runs/final/the-crusades-an-authoritative-history/the-crusades-an-authoritative-history-episode-4/spoken_delivery_arc_plan.json,.podcast_agent/runs/final/the-crusades-an-authoritative-history/the-crusades-an-authoritative-history-episode-4/spoken_script.json
the-crusades-an-authoritative-history,the-crusades-an-authoritative-history-episode-4,7,"Richard takes the cross in a thunderclap without consulting Henry II, opening a conflict between crusader glory and dynastic duty",1,6,The choice that made Richard a crusading legend had always carried a price: every month in Palestine meant another month his kingdom was left behind.,True,11/12,exact,0.5,8,The choice that made Richard a crusading legend had always carried a price.,.podcast_agent/runs/final/the-crusades-an-authoritative-history/the-crusades-an-authoritative-history-episode-4/spoken_delivery_arc_plan.json,.podcast_agent/runs/final/the-crusades-an-authoritative-history/the-crusades-an-authoritative-history-episode-4/spoken_script.json
the-crusades-an-authoritative-history,the-crusades-an-authoritative-history-episode-5,1,Crusading cannot simply be commanded from above,1,8,"Remember Innocent's discovery at the very start: holy war could be organized from Rome, taxed from Rome, preached from Rome—but not fully controlled from Rome.",True,4/5,exact,0.636,7,"Holy war could be organized from Rome, taxed from Rome, preached from Rome, but not fully controlled from Rome.",.podcast_agent/runs/final/the-crusades-an-authoritative-history/the-crusades-an-authoritative-history-episode-5/spoken_delivery_arc_plan.json,.podcast_agent/runs/final/the-crusades-an-authoritative-history/the-crusades-an-authoritative-history-episode-5/spoken_script.json
the-crusades-an-authoritative-history,the-crusades-an-authoritative-history-episode-5,2,"Acre is not just a fortress but a trading world—crowded, wealthy, multilingual, and indispensable",2,8,"This was the same Acre James knew: filthy sea, busy harbor, merchant quarters, seventy churches—and now the last doorway between Outremer and the West.",True,5/8,weak,0.267,4,This was the same Acre James knew.,.podcast_agent/runs/final/the-crusades-an-authoritative-history/the-crusades-an-authoritative-history-episode-5/spoken_delivery_arc_plan.json,.podcast_agent/runs/final/the-crusades-an-authoritative-history/the-crusades-an-authoritative-history-episode-5/spoken_script.json
the-crusades-an-authoritative-history,the-crusades-an-authoritative-history-episode-5,3,Egypt is treated as the real key to Jerusalem,2,3,"The logic hardened into doctrine: if you could not take Jerusalem directly, you broke the power that fed it—Egypt.",True,4/4,semantic,0.444,4,"If Jerusalem could not be reached directly, strike Egypt, the source of the power that held it.",.podcast_agent/runs/final/the-crusades-an-authoritative-history/the-crusades-an-authoritative-history-episode-5/spoken_delivery_arc_plan.json,.podcast_agent/runs/final/the-crusades-an-authoritative-history/the-crusades-an-authoritative-history-episode-5/spoken_script.json
the-crusades-an-authoritative-history,the-crusades-an-authoritative-history-episode-5,4,"The Nile, its canals, and its flood can destroy a crusade as surely as any army",3,5,"The old warning from the Fifth Crusade was still there in the landscape, waiting for Louis on the same river.",True,4/7,exact,1.0,8,"The old warning from the Fifth Crusade was still there in the landscape, waiting for Louis on the same river.",.podcast_agent/runs/final/the-crusades-an-authoritative-history/the-crusades-an-authoritative-history-episode-5/spoken_delivery_arc_plan.json,.podcast_agent/runs/final/the-crusades-an-authoritative-history/the-crusades-an-authoritative-history-episode-5/spoken_script.json
the-crusades-an-authoritative-history,the-crusades-an-authoritative-history-episode-5,5,Expectation of a 'great king from the West' encourages delay and bad decisions,3,7,"Again and again they waited for the western savior—Frederick, then Louis, then Edward—and again and again the timing broke against them.",True,4/7,semantic,0.455,5,Again and again the timing broke against them.,.podcast_agent/runs/final/the-crusades-an-authoritative-history/the-crusades-an-authoritative-history-episode-5/spoken_delivery_arc_plan.json,.podcast_agent/runs/final/the-crusades-an-authoritative-history/the-crusades-an-authoritative-history-episode-5/spoken_script.json
the-crusades-an-authoritative-history,the-crusades-an-authoritative-history-episode-5,6,The Military Orders are the year-round backbone of survival,2,7,The same Orders that had held the line were now being reduced one fortress at a time.,True,5/6,exact,1.0,7,The same Orders that had held the line were now being reduced one fortress at a time.,.podcast_agent/runs/final/the-crusades-an-authoritative-history/the-crusades-an-authoritative-history-episode-5/spoken_delivery_arc_plan.json,.podcast_agent/runs/final/the-crusades-an-authoritative-history/the-crusades-an-authoritative-history-episode-5/spoken_script.json
the-crusades-an-authoritative-history,the-crusades-an-authoritative-history-episode-5,7,The mamluks first appear as elite soldiers inside someone else's regime,5,6,Those hard professionals under Ayyubid banners were about to become rulers in their own right.,True,7/9,weak,0.222,2,"For the moment, they were still fighting under Ayyubid banners.",.podcast_agent/runs/final/the-crusades-an-authoritative-history/the-crusades-an-authoritative-history-episode-5/spoken_delivery_arc_plan.json,.podcast_agent/runs/final/the-crusades-an-authoritative-history/the-crusades-an-authoritative-history-episode-5/spoken_script.json
the-crusades-an-authoritative-history,the-crusades-an-authoritative-history-episode-5,8,"Baybars's strength lies in speed, intelligence, and method—not just battlefield courage",6,7,"This was Baybars's system at work: sealed orders, spies, courier lines, siege engines, and no wasted motion.",True,6/8,weak,0.25,3,This was Baybars's system at work.,.podcast_agent/runs/final/the-crusades-an-authoritative-history/the-crusades-an-authoritative-history-episode-5/spoken_delivery_arc_plan.json,.podcast_agent/runs/final/the-crusades-an-authoritative-history/the-crusades-an-authoritative-history-episode-5/spoken_script.json
the-fall-of-the-ottomans-the-great-war-in-the-middle-east,episode-1,1,Abdülhamid is left on the throne after 1908 because he is still revered as sultan and caliph,2,3,"Remember: they restored the constitution, but they did not remove the man who had buried it.",True,7/7,exact,1.0,5,"Remember: they restored the constitution, but they did not remove the man who had buried it.",.podcast_agent/runs/final/the-fall-of-the-ottomans-the-great-war-in-the-middle-east/episode-1/spoken_delivery_arc_plan.json,.podcast_agent/runs/final/the-fall-of-the-ottomans-the-great-war-in-the-middle-east/episode-1/spoken_script.json
the-fall-of-the-ottomans-the-great-war-in-the-middle-east,episode-1,2,"The revolutionary promise of ""Justice, Equality, and Fraternity"" and a shared Ottoman patriotism",2,3,"Those banners had promised brotherhood. In Adana, that promise was burning with the houses.",True,8/8,exact,0.5,4,Those banners had promised brotherhood.,.podcast_agent/runs/final/the-fall-of-the-ottomans-the-great-war-in-the-middle-east/episode-1/spoken_delivery_arc_plan.json,.podcast_agent/runs/final/the-fall-of-the-ottomans-the-great-war-in-the-middle-east/episode-1/spoken_script.json
