book,episode,plant_index,fact,plant_in_act,payoff_in_act,bridging_language,plant_landed,plant_keyword_hits,payoff_class,payoff_overlap,payoff_common_tokens,best_matching_sentence,arc_plan_path,spoken_script_path
india-in-the-persianate-age,india-in-the-persianate-age-episode-2,5,Mahmud Gawan is destroyed by a forged letter made with his own seal.,5,6,That single forged page did what invading armies had not: it broke the state from within.,True,7/7,exact,1.0,8,That single forged page did what invading armies had not: it broke the state from within.,.podcast_agent/runs/final/india-in-the-persianate-age/india-in-the-persianate-age-episode-2/spoken_delivery_arc_plan.json,.podcast_agent/runs/final/india-in-the-persianate-age/india-in-the-persianate-age-episode-2/spoken_script.json
india-in-the-persianate-age,india-in-the-persianate-age-episode-2,6,"At Raichur, artillery delivers a lesson — but the two sides learn opposite lessons from the same battle.",6,7,Raichur had already taught the lesson. Only one side really listened.,True,7/10,exact,0.5,3,Raichur had already taught the lesson.,.podcast_agent/runs/final/india-in-the-persianate-age/india-in-the-persianate-age-episode-2/spoken_delivery_arc_plan.json,.podcast_agent/runs/final/india-in-the-persianate-age/india-in-the-persianate-age-episode-2/spoken_script.json
india-in-the-persianate-age,india-in-the-persianate-age-episode-2,7,Warangal’s remembered four-gated sacred geometry remains alive in Qutb Shahi political imagination.,5,7,The new city looked new — until you noticed the old Kakatiya map beneath it.,True,8/12,exact,1.0,6,The new city looked new — until you noticed the old Kakatiya map beneath it.,.podcast_agent/runs/final/india-in-the-persianate-age/india-in-the-persianate-age-episode-2/spoken_delivery_arc_plan.json,.podcast_agent/runs/final/india-in-the-persianate-age/india-in-the-persianate-age-episode-2/spoken_script.json
india-in-the-persianate-age,india-in-the-persianate-age-episode-2,8,The Vijayanagara hon is trusted on both sides of the Krishna.,5,7,"Even when dynasties changed, the coin in people’s hands kept remembering Vijayanagara.",True,3/4,exact,1.0,9,"Even when dynasties changed, the coin in people’s hands kept remembering Vijayanagara.",.podcast_agent/runs/final/india-in-the-persianate-age/india-in-the-persianate-age-episode-2/spoken_delivery_arc_plan.json,.podcast_agent/runs/final/india-in-the-persianate-age/india-in-the-persianate-age-episode-2/spoken_script.json
india-in-the-persianate-age,india-in-the-persianate-age-episode-3,1,"Babur's dying order to Humayun: 'do nothing against your brothers, even if they deserve it.'",2,3,Remember Babur's last instruction—the mercy that sounded noble at a deathbed becomes disastrous once Humayun tries to rule by it.,True,9/10,semantic,0.571,8,The mercy that sounded noble at a deathbed became disastrous once Humayun tried to rule by it.,.podcast_agent/runs/final/india-in-the-persianate-age/india-in-the-persianate-age-episode-3/spoken_delivery_arc_plan.json,.podcast_agent/runs/final/india-in-the-persianate-age/india-in-the-persianate-age-episode-3/spoken_script.json
india-in-the-persianate-age,india-in-the-persianate-age-episode-3,2,"Sher Shah's systems: land measurement, the silver rupiya, roads, and orderly administration.",3,7,The irony is that some of the empire's strongest bones were laid down by the man who drove the Mughals out.,True,9/10,exact,1.0,8,The irony is that some of the empire’s strongest bones were laid down by the man who drove the Mughals out.,.podcast_agent/runs/final/india-in-the-persianate-age/india-in-the-persianate-age-episode-3/spoken_delivery_arc_plan.json,.podcast_agent/runs/final/india-in-the-persianate-age/india-in-the-persianate-age-episode-3/spoken_script.json
india-in-the-persianate-age,india-in-the-persianate-age-episode-3,3,Bharmal's marriage alliance with Akbar and the promise that Rajput chiefs could keep their watan jagirs and religion.,4,6,"What began as one Amber family quarrel ends up inside the dynasty itself—in the army, in the court, even in the bloodline of the future emperors.",True,9/11,semantic,0.5,7,What began as one Amber family quarrel ended up inside the dynasty itself.,.podcast_agent/runs/final/india-in-the-persianate-age/india-in-the-persianate-age-episode-3/spoken_delivery_arc_plan.json,.podcast_agent/runs/final/india-in-the-persianate-age/india-in-the-persianate-age-episode-3/spoken_script.json
india-in-the-persianate-age,india-in-the-persianate-age-episode-3,4,"Akbar's public struggle to define religious authority: the hunt collapse, the failed sermon, the 1579 claim to final interpretation.",5,7,"Akbar had experimented in public; Shah Jahan will inherit the result in a colder form—a kingship that no longer argues, only radiates.",True,12/13,semantic,0.538,7,"Shah Jahan inherited the result in a colder form, a kingship that no longer argued, only radiated.",.podcast_agent/runs/final/india-in-the-persianate-age/india-in-the-persianate-age-episode-3/spoken_delivery_arc_plan.json,.podcast_agent/runs/final/india-in-the-persianate-age/india-in-the-persianate-age-episode-3/spoken_script.json
india-in-the-persianate-age,india-in-the-persianate-age-episode-3,5,"The empire's habit of absorbing enemies through ceremony—robes, titles, prostration, negotiated submission, and shared service.",5,6,"This is how Mughal power often worked at the edges: not by erasing rivals, but by teaching them the grammar of belonging.",True,11/12,exact,0.545,6,"Not by erasing rivals, but by teaching them the grammar of belonging.",.podcast_agent/runs/final/india-in-the-persianate-age/india-in-the-persianate-age-episode-3/spoken_delivery_arc_plan.json,.podcast_agent/runs/final/india-in-the-persianate-age/india-in-the-persianate-age-episode-3/spoken_script.json
india-in-the-persianate-age,india-in-the-persianate-age-episode-3,6,"Khurram's years of rebellion as a training ground in alliance-building across the Deccan, Bengal, and Indo-Afghan networks.",6,7,The prince who comes to the throne is not just a victor in a palace struggle; he is a man who learned empire by running through it.,True,11/12,semantic,0.556,5,The prince who came to the throne later would not be just a victor in a palace struggle.,.podcast_agent/runs/final/india-in-the-persianate-age/india-in-the-persianate-age-episode-3/spoken_delivery_arc_plan.json,.podcast_agent/runs/final/india-in-the-persianate-age/india-in-the-persianate-age-episode-3/spoken_script.json
india-in-the-persianate-age,india-in-the-persianate-age-episode-4,1,Aurangzeb as the boy who faces the charging elephant without fleeing,1,6,"Remember the prince who would not turn his horse away from the elephant. Decades later, the emperor still could not turn away from a war.",True,3/5,exact,0.667,6,Remember the prince who would not turn his horse away from the elephant.,.podcast_agent/runs/final/india-in-the-persianate-age/india-in-the-persianate-age-episode-4/spoken_delivery_arc_plan.json,.podcast_agent/runs/final/india-in-the-persianate-age/india-in-the-persianate-age-episode-4/spoken_script.json
india-in-the-persianate-age,india-in-the-persianate-age-episode-4,2,The underground room episode: Aurangzeb believes Dara may shut the brothers in and kill them,1,3,What began with a doorway and a wink now ends in chains and execution.,True,9/10,semantic,0.833,5,What began with a doorway and a wink now ended in chains and execution.,.podcast_agent/runs/final/india-in-the-persianate-age/india-in-the-persianate-age-episode-4/spoken_delivery_arc_plan.json,.podcast_agent/runs/final/india-in-the-persianate-age/india-in-the-persianate-age-episode-4/spoken_script.json
india-in-the-persianate-age,india-in-the-persianate-age-episode-4,3,"Dara's claim that the hidden Book could be the Upanishads, and his identification of the Vedas as divine scripture",2,3,The language Dara had used to elevate himself would later be read back as evidence against him.,True,7/9,exact,1.0,10,And the language Dara had used to elevate himself would later be read back as evidence against him.,.podcast_agent/runs/final/india-in-the-persianate-age/india-in-the-persianate-age-episode-4/spoken_delivery_arc_plan.json,.podcast_agent/runs/final/india-in-the-persianate-age/india-in-the-persianate-age-episode-4/spoken_script.json
india-in-the-persianate-age,india-in-the-persianate-age-episode-4,4,"Dara's habit of insulting and humiliating powerful men, including beating Khalil Allah Khan with a shoe",2,3,"On the field at Samugarh, old humiliations took their revenge.",True,7/11,semantic,0.8,4,"And on that field, old humiliations took their revenge.",.podcast_agent/runs/final/india-in-the-persianate-age/india-in-the-persianate-age-episode-4/spoken_delivery_arc_plan.json,.podcast_agent/runs/final/india-in-the-persianate-age/india-in-the-persianate-age-episode-4/spoken_script.json
india-in-the-persianate-age,india-in-the-persianate-age-episode-4,5,"The Deccan first teaches Aurangzeb ambition, revenue repair, and unfinished business; Shahji Bhonsle escapes him",1,5,The frontier that made Aurangzeb as a prince is the same frontier that traps him as emperor.,True,10/12,semantic,0.857,6,The frontier that made Aurangzeb as a prince was the same frontier that trapped him as emperor.,.podcast_agent/runs/final/india-in-the-persianate-age/india-in-the-persianate-age-episode-4/spoken_delivery_arc_plan.json,.podcast_agent/runs/final/india-in-the-persianate-age/india-in-the-persianate-age-episode-4/spoken_script.json
india-in-the-persianate-age,india-in-the-persianate-age-episode-4,6,"Shahu, Sambhaji's young son, captured and raised in the Mughal camp",5,7,One captive child from Aurangzeb's moving court would later be released into Maratha politics like a wedge.,True,7/7,semantic,0.909,10,One captive child from Aurangzeb’s moving court was now released into Maratha politics like a wedge.,.podcast_agent/runs/final/india-in-the-persianate-age/india-in-the-persianate-age-episode-4/spoken_delivery_arc_plan.json,.podcast_agent/runs/final/india-in-the-persianate-age/india-in-the-persianate-age-episode-4/spoken_script.json
india-in-the-persianate-age,india-in-the-persianate-age-episode-4,7,Aurangzeb's complaint that there was 'only one pomegranate to serve a hundred sick men',6,7,"That was not just a metaphor. After his death, imperial appointments really did become promises on paper with no revenue behind them.",True,5/8,semantic,0.909,10,"After Aurangzeb’s death, imperial appointments really did become promises on paper with no revenue behind them.",.podcast_agent/runs/final/india-in-the-persianate-age/india-in-the-persianate-age-episode-4/spoken_delivery_arc_plan.json,.podcast_agent/runs/final/india-in-the-persianate-age/india-in-the-persianate-age-episode-4/spoken_script.json
india-in-the-persianate-age,india-in-the-persianate-age-episode-4,8,The early refusal from Mecca to recognize Aurangzeb while Shah Jahan still lives,4,4,"Even far from India, the problem was the same: could a king be lawful while his father still lived?",True,5/8,exact,0.5,4,"Even far from India, the problem was the same.",.podcast_agent/runs/final/india-in-the-persianate-age/india-in-the-persianate-age-episode-4/spoken_delivery_arc_plan.json,.podcast_agent/runs/final/india-in-the-persianate-age/india-in-the-persianate-age-episode-4/spoken_script.json
india-in-the-persianate-age,india-in-the-persianate-age-episode-4,9,Silver entering Mughal India through global trade,7,8,The same silver that once strengthened Mughal revenues would help finance the powers that outgrew Mughal control.,True,6/6,exact,1.0,11,The same silver that once strengthened Mughal revenues would help finance the powers that outgrew Mughal control.,.podcast_agent/runs/final/india-in-the-persianate-age/india-in-the-persianate-age-episode-4/spoken_delivery_arc_plan.json,.podcast_agent/runs/final/india-in-the-persianate-age/india-in-the-persianate-age-episode-4/spoken_script.json
midnight-s-furies-the-deadly-legacy-of-india-s-partition,episode-1,1,Wavell's private 'breakdown plan',2,5,"Remember: even while offering Nehru a government, Wavell was already sketching a fallback for collapse. By winter, the army had a name for the same fear: Operation Madhouse.",False,1/4,semantic,0.562,9,"Remember: even while offering Nehru a government, Wavell was already sketching a fallback for collapse.",.podcast_agent/runs/final/midnight-s-furies-the-deadly-legacy-of-india-s-partition/episode-1/spoken_delivery_arc_plan.json,.podcast_agent/runs/final/midnight-s-furies-the-deadly-legacy-of-india-s-partition/episode-1/spoken_script.json
midnight-s-furies-the-deadly-legacy-of-india-s-partition,episode-1,2,Jinnah was once celebrated as the 'Ambassador of Unity',3,4,The man once hailed as the Ambassador of Unity was now summoning 'direct action'—and Calcutta would hear what that sounded like.,True,2/5,semantic,0.727,8,The man once hailed as the Ambassador of Unity is now summoning ‘direct action.’ Calcutta is about to hear what that sounds like.,.podcast_agent/runs/final/midnight-s-furies-the-deadly-legacy-of-india-s-partition/episode-1/spoken_delivery_arc_plan.json,.podcast_agent/runs/final/midnight-s-furies-the-deadly-legacy-of-india-s-partition/episode-1/spoken_script.json
midnight-s-furies-the-deadly-legacy-of-india-s-partition,episode-1,3,Pakistan's power lay partly in its vagueness,3,7,"As long as Pakistan was a promise, it could mean anything. The moment Mountbatten forced it onto a map, someone had to lose Lahore, Calcutta, or both.",True,4/4,semantic,0.417,5,"As long as Pakistan was a promise, it could mean anything.",.podcast_agent/runs/final/midnight-s-furies-the-deadly-legacy-of-india-s-partition/episode-1/spoken_delivery_arc_plan.json,.podcast_agent/runs/final/midnight-s-furies-the-deadly-legacy-of-india-s-partition/episode-1/spoken_script.json
midnight-s-furies-the-deadly-legacy-of-india-s-partition,episode-1,4,"Punjab is the Sikh homeland, and Sikhs have a soldierly tradition disproportionate to their numbers",1,6,"Those details from the opening now matter: this was not just any province. It was a homeland full of people trained to think in terms of defense, honor, and retaliation.",True,5/8,semantic,0.643,9,"It is a homeland full of people trained to think in terms of defense, honor, and retaliation.",.podcast_agent/runs/final/midnight-s-furies-the-deadly-legacy-of-india-s-partition/episode-1/spoken_delivery_arc_plan.json,.podcast_agent/runs/final/midnight-s-furies-the-deadly-legacy-of-india-s-partition/episode-1/spoken_script.json
midnight-s-furies-the-deadly-legacy-of-india-s-partition,episode-1,5,"Nehru's remark that if the government proved strong, 'the League's movement would go down'",2,5,"The weak government Nehru had shrugged at did not steady the country. Once the League entered it, the whole machine began to seize from the inside.",True,6/9,semantic,0.429,6,"Once the League enters it, the whole machine begins to seize from the inside.",.podcast_agent/runs/final/midnight-s-furies-the-deadly-legacy-of-india-s-partition/episode-1/spoken_delivery_arc_plan.json,.podcast_agent/runs/final/midnight-s-furies-the-deadly-legacy-of-india-s-partition/episode-1/spoken_script.json
midnight-s-furies-the-deadly-legacy-of-india-s-partition,episode-1,6,The Aga Khan's warning that the bitterness being stirred up would be paid for 'a hundred percent',3,5,That old warning about bitterness being paid in full was no longer theoretical. It was being collected village by village.,True,5/7,semantic,0.778,7,That old warning about bitterness being paid in full is no longer theoretical.,.podcast_agent/runs/final/midnight-s-furies-the-deadly-legacy-of-india-s-partition/episode-1/spoken_delivery_arc_plan.json,.podcast_agent/runs/final/midnight-s-furies-the-deadly-legacy-of-india-s-partition/episode-1/spoken_script.json
midnight-s-furies-the-deadly-legacy-of-india-s-partition,episode-2,1,The 15 August deadline and the image of Raj officials counting down on wall calendars,1,4,Those calendar pages were gone now. The border still wasn't there.,True,5/7,exact,0.667,4,Those calendar pages were gone now.,.podcast_agent/runs/final/midnight-s-furies-the-deadly-legacy-of-india-s-partition/episode-2/spoken_delivery_arc_plan.json,.podcast_agent/runs/final/midnight-s-furies-the-deadly-legacy-of-india-s-partition/episode-2/spoken_script.json
midnight-s-furies-the-deadly-legacy-of-india-s-partition,episode-2,2,Brendon effectively green-lighting armed Meo self-defense and Nehru's conclusion that British officials no longer meant to keep order,1,5,"Remember Gurgaon, where even the custodians of order had started talking like partisans.",True,13/15,exact,1.0,9,"Remember Gurgaon, where even the custodians of order had started talking like partisans.",.podcast_agent/runs/final/midnight-s-furies-the-deadly-legacy-of-india-s-partition/episode-2/spoken_delivery_arc_plan.json,.podcast_agent/runs/final/midnight-s-furies-the-deadly-legacy-of-india-s-partition/episode-2/spoken_script.json
midnight-s-furies-the-deadly-legacy-of-india-s-partition,episode-2,3,"Mountbatten saying of Sikh and Muslim demands, ""I am no magician""",2,4,"He had said he was no magician. But by August, everyone was demanding a miracle from an invisible line.",True,6/6,semantic,0.75,6,"But by August, everyone would be demanding a miracle from an invisible line.",.podcast_agent/runs/final/midnight-s-furies-the-deadly-legacy-of-india-s-partition/episode-2/spoken_delivery_arc_plan.json,.podcast_agent/runs/final/midnight-s-furies-the-deadly-legacy-of-india-s-partition/episode-2/spoken_script.json
midnight-s-furies-the-deadly-legacy-of-india-s-partition,episode-2,4,Arrest and authority no longer meaning much in Punjab because release was expected after independence,2,5,"By now, the old warning was coming true: arrest no longer meant order.",True,9/9,semantic,1.0,7,But the old warning was coming true: arrest no longer meant order.,.podcast_agent/runs/final/midnight-s-furies-the-deadly-legacy-of-india-s-partition/episode-2/spoken_delivery_arc_plan.json,.podcast_agent/runs/final/midnight-s-furies-the-deadly-legacy-of-india-s-partition/episode-2/spoken_script.json
midnight-s-furies-the-deadly-legacy-of-india-s-partition,episode-2,5,Jinnah rejecting the shared governor-general,3,5,"The moment he refused a figure above the divide, there would be no one left to speak for both Punjabs.",True,4/5,semantic,1.0,8,"The moment Jinnah refused a figure above the divide, there would be no one left to speak for both Punjabs.",.podcast_agent/runs/final/midnight-s-furies-the-deadly-legacy-of-india-s-partition/episode-2/spoken_delivery_arc_plan.json,.podcast_agent/runs/final/midnight-s-furies-the-deadly-legacy-of-india-s-partition/episode-2/spoken_script.json
midnight-s-furies-the-deadly-legacy-of-india-s-partition,episode-2,6,Nehru's 3 June appeal to bury bitterness and end the shameful violence,1,6,"Remember Nehru asking the country to bury its bitterness. In Delhi now, bitterness was running the streets.",True,7/7,exact,0.667,6,Remember Nehru asking the country to bury its bitterness.,.podcast_agent/runs/final/midnight-s-furies-the-deadly-legacy-of-india-s-partition/episode-2/spoken_delivery_arc_plan.json,.podcast_agent/runs/final/midnight-s-furies-the-deadly-legacy-of-india-s-partition/episode-2/spoken_script.json
midnight-s-furies-the-deadly-legacy-of-india-s-partition,episode-2,7,Jinnah's early Pakistani pledge that religion would have nothing to do with the business of the state,4,6,"Only days after promising equal citizenship, Pakistan's leaders were receiving trainloads of proof that equal citizenship was already collapsing on the ground.",True,7/8,exact,1.0,11,"Only days after promising equal citizenship, Pakistan’s leaders were receiving trainloads of proof that equal citizenship was already collapsing on the ground.",.podcast_agent/runs/final/midnight-s-furies-the-deadly-legacy-of-india-s-partition/episode-2/spoken_delivery_arc_plan.json,.podcast_agent/runs/final/midnight-s-furies-the-deadly-legacy-of-india-s-partition/episode-2/spoken_script.json
midnight-s-furies-the-deadly-legacy-of-india-s-partition,episode-2,8,The Boundary Force that looked powerful on paper but was starved in practice,4,5,The force that was supposed to hold the border existed mostly on paper. Punjab was being left to the men with the faster feet and the sharper blades.,True,5/7,weak,0.231,3,Now even the force meant to hold the border together was effectively finished.,.podcast_agent/runs/final/midnight-s-furies-the-deadly-legacy-of-india-s-partition/episode-2/spoken_delivery_arc_plan.json,.podcast_agent/runs/final/midnight-s-furies-the-deadly-legacy-of-india-s-partition/episode-2/spoken_script.json
midnight-s-furies-the-deadly-legacy-of-india-s-partition,episode-3,1,Nehru's offer of a 'free and fair plebiscite' during the Junagadh argument,1,5,Remember the principle Nehru offered so readily over Junagadh; in Kashmir it becomes the promise both sides invoke and neither is prepared to trust.,True,5/7,semantic,0.462,6,Remember the principle Nehru offered so readily over Junagadh.,.podcast_agent/runs/final/midnight-s-furies-the-deadly-legacy-of-india-s-partition/episode-3/spoken_delivery_arc_plan.json,.podcast_agent/runs/final/midnight-s-furies-the-deadly-legacy-of-india-s-partition/episode-3/spoken_script.json
midnight-s-furies-the-deadly-legacy-of-india-s-partition,episode-3,2,British commanders refuse to let British officers lead one dominion's forces against the other,1,4,The same imperial brake that stopped Patel in Junagadh now stops Jinnah in Kashmir—and pushes both sides toward irregular war instead.,True,8/9,semantic,0.571,8,The same imperial brake that stopped Patel in Junagadh now stopped Jinnah in Kashmir.,.podcast_agent/runs/final/midnight-s-furies-the-deadly-legacy-of-india-s-partition/episode-3/spoken_delivery_arc_plan.json,.podcast_agent/runs/final/midnight-s-furies-the-deadly-legacy-of-india-s-partition/episode-3/spoken_script.json
midnight-s-furies-the-deadly-legacy-of-india-s-partition,episode-3,3,K. H. Khurshid as the young reporter who once rowed gossip to Jinnah on Dal Lake,2,3,That boatman-turned-aide comes back with more than gossip this time; he brings the bleak report that force may be Pakistan's only path into Kashmir.,True,8/8,semantic,0.429,6,That boatman-turned-aide would come back with more than gossip this time.,.podcast_agent/runs/final/midnight-s-furies-the-deadly-legacy-of-india-s-partition/episode-3/spoken_delivery_arc_plan.json,.podcast_agent/runs/final/midnight-s-furies-the-deadly-legacy-of-india-s-partition/episode-3/spoken_script.json
midnight-s-furies-the-deadly-legacy-of-india-s-partition,episode-3,4,Patel had once been willing to let Kashmir go to Pakistan,2,4,Junagadh changed Patel's arithmetic; the man once ready to yield Kashmir is now tearing seats out of planes to hold it.,True,5/5,semantic,0.5,6,The man once prepared to let Kashmir go was now tearing seats out of planes to hold it.,.podcast_agent/runs/final/midnight-s-furies-the-deadly-legacy-of-india-s-partition/episode-3/spoken_delivery_arc_plan.json,.podcast_agent/runs/final/midnight-s-furies-the-deadly-legacy-of-india-s-partition/episode-3/spoken_script.json
midnight-s-furies-the-deadly-legacy-of-india-s-partition,episode-3,5,"Jinnah says, 'Don't tell me anything about it. My conscience must be clear.'",3,7,"The conscience Jinnah tried to keep clear is no longer protected by ambiguity; by spring, formed Pakistani units are in the war.",True,6/8,semantic,0.667,8,The conscience Jinnah had tried to keep clear was no longer protected by ambiguity.,.podcast_agent/runs/final/midnight-s-furies-the-deadly-legacy-of-india-s-partition/episode-3/spoken_delivery_arc_plan.json,.podcast_agent/runs/final/midnight-s-furies-the-deadly-legacy-of-india-s-partition/episode-3/spoken_script.json
midnight-s-furies-the-deadly-legacy-of-india-s-partition,episode-3,6,Gandhi presses the cabinet to release Pakistan's funds and calls starving Pakistan dishonorable,6,6,"The old man who tried to force one last moral accounting in Delhi will be dead within days, and the state he tried to steady will harden without him.",True,8/10,weak,0.167,2,"Nehru demanded that Baramulla be retaken at “every cost and every consequence,” and within three days.",.podcast_agent/runs/final/midnight-s-furies-the-deadly-legacy-of-india-s-partition/episode-3/spoken_delivery_arc_plan.json,.podcast_agent/runs/final/midnight-s-furies-the-deadly-legacy-of-india-s-partition/episode-3/spoken_script.json
midnight-s-furies-the-deadly-legacy-of-india-s-partition,episode-3,7,Menon is already thinking beyond Junagadh to Hyderabad,1,7,"That second map point Menon had in mind all along—Hyderabad—now returns at full scale, with smugglers, ultimatums, and armor.",True,5/5,semantic,0.667,8,"That second map point Menon had in mind all along, Hyderabad, was now returning at full scale.",.podcast_agent/runs/final/midnight-s-furies-the-deadly-legacy-of-india-s-partition/episode-3/spoken_delivery_arc_plan.json,.podcast_agent/runs/final/midnight-s-furies-the-deadly-legacy-of-india-s-partition/episode-3/spoken_script.json
midnight-s-furies-the-deadly-legacy-of-india-s-partition,episode-3,8,"Reports of weapons delayed, diverted, or stuck in depots",4,6,"The paperwork and sabotage that delayed arms at the start come back in darker form, with guns allegedly disappearing toward RSS men in Jammu.",True,5/6,semantic,0.571,8,The paperwork and sabotage that had delayed arms at the start came back in darker form.,.podcast_agent/runs/final/midnight-s-furies-the-deadly-legacy-of-india-s-partition/episode-3/spoken_delivery_arc_plan.json,.podcast_agent/runs/final/midnight-s-furies-the-deadly-legacy-of-india-s-partition/episode-3/spoken_script.json
